<?xml version="1.0"?>
<!--
/**
 * Copyright Â© 2015 Magento. All rights reserved.
 * See COPYING.txt for license details.
 */
-->
<config xmlns:xsi="http://www.w3.org/2001/XMLSchema-instance" xsi:noNamespaceSchemaLocation="../../../../../../../../../../app/code/Magento/Indexer/etc/indexer.xsd">
    <indexer id="indexer_1" view_id="catalogsearch_fulltext" class="Magento\CatalogSearch\Model\Indexer\Fulltext">
        <title translate="true">Test Indexer Declaration 1</title>
        <description translate="true">Test Indexer Declaration 1</description>
        <fields handler="Magento\Framework\Search\Index\Fields\Handler">
            <field name="title" origin="table_name.field_name" handler="Magento\Framework\Search\Index\Field\Handler\Class" xsi:type="both">
                <filter class="Magento\Framework\Search\Index\Filter\StopWordsFilter"/>
            </field>
            <field name="description" origin="table_name.field_name" handler="Magento\Framework\Search\Index\Field\Handler\Class" xsi:type="match">
                <filter class="Magento\Framework\Search\Index\Filter\LowercaseFilter"/>
            </field>
            <field name="visibility" origin="table_name.field_name" handler="Magento\Framework\Search\Index\Field\Handler\Class" xsi:type="filter" dataType="int" />
        </fields>
    </indexer>
</config>
